{
  "from": "2026-07-17T00:00:00.000Z",
  "to": "2026-07-18T00:00:00.000Z",
  "timezone": "Asia/Shanghai",
  "page_size": 50,
  "filter_match": "all",
  "conditions": [
    {
      "kind": "builtin",
      "field": "model_tag",
      "operator": "equals",
      "values": ["openai/gpt-5-mini"]
    }
  ],
  "metric": "requests",
  "grain": "day",
  "group_dimension": "model_tag"
}
